Context,Question,Answer,Question_type,Domain,Annotator1_QuestionObjective,Annotator1_ContextRelevant,Annotator1_DomainAgree,Annotator1_QuestionTypeAgree,Annotator1_AnswerCorrect,Annotator1_AnswerComplete,Annotator1_QuestionCorrect,Annotator1_QuestionComplete,Annotator2_QuestionObjective,Annotator2_ContextRelevant,Annotator2_DomainAgree,Annotator2_QuestionTypeAgree,Annotator2_AnswerCorrect,Annotator2_AnswerComplete,Annotator2_QuestionCorrect,Annotator2_QuestionComplete
"Эукариоттар – сыртынан қабықшамен қапталған клеткасында цитоплазмасы және айқын көрінетін ядросы бар организмдер. Ядрода тұқым қуалау ақпараты орналасқан. Барлық эукариоттар үш дүниеге бөлінеді: өсімдіктер, саңырауқұлақтар және жануарлар.",Эукариоттар деген не?,Сыртынан қабықшамен қапталған клеткасында цитоплазмасы және айқын көрінетін ядросы бар организмдер.,Factoid,bio,1,1,1,0,2,2,2,2,1,1,1,0,2,2,2,2.0
"Саңырауқұлақтар – төменгi сатыдағы эукариоттар, тiрi организмдер дүниесi. Саңырауқұлақтардың ерекшелiгi өсiмдiк белгiлерiнiң , жануарлар белгiлерiнiң   ерекше даму циклiнің болуында.","Төменгі сатыдағы эукариоттар, олар?",Саңырауқұлақтар.,Factoid,bio,1,1,1,1,2,2,2,2,1,1,1,1,2,2,2,2.0
"Приматтар - жоғары сатыдағы сүтқоректілер отряды. Бұлардың арғы тегі қарапайым жәндікқоректі сүтқоректілер деп есептелінеді. Приматтар өздері мекендейтін аумақтарын белгілеп, сол жерде топтасып өмір сүреді. Қорегі — өсімдік жемісі, жапырағы, гүлі, тамыр жемісі, жәндіктер.",Приматтар немен қоректенеді?,"Өсімдік жемісімен, жапырағымен, гүлімен, тамырымен, жемісімен, жәндіктермен.",Factoid,bio,1,1,1,1,2,2,2,2,1,1,1,1,2,2,2,2.0
Генотип деп — ата-аналардан алынатын гендердің толық жиынтығын айтады. Генотипіне қарай организм гомозиготалы не гетерозиготалы болуы мүмкін.,Генотип деген не?,Ата-аналардан алынатын гендердің толық жиынтығы.,Factoid,bio,1,1,1,1,2,2,2,2,1,1,1,1,2,2,2,2.0
"Суда тіршілік етуге бейімделген организмдер тобы — гидробионттар деп аталады. Олар судың түрлі қабаттарында тіршілік етуге бейімделген. Гидробионттар Дүниежүзілік мұхиттарда, жер асты суларында, құрлықтағы су айдындарында кеңінен таралған.",Суда тіршілік етуге бейімделген организмдер тобы?,Гидробионттар.,Factoid,bio,1,1,1,1,2,1,2,2,1,1,1,1,2,1,2,2.0
"Құрлықта тіршілік етуге бейімделген организмдерді террабионттар (латынша terra — жер) деп атайды. Бұл ортада тіршілік ететін организмдер денесіндегі суды үнемдеп жұмсайды, жылу реттеу механизмдері де түрліше.",Террабионттар олар?,Құрлықта тіршілік етуге бейімделген организмдер.,Factoid,bio,1,1,1,1,2,2,2,2,1,1,1,1,2,2,2,2.0
"Популяция (латын тілінде populus — халық, тұрғын халық) — белгілі бір кеңістікте генетикалық жүйе түзетін, бір түрге жататын және көбею арқылы өзін-өзі жаңғыртып отыратын организмдер тобы. Әр популяция өзіне ғана тән статистикалық сипаттамалары  және динамикалық сипаттамалары  бойынша ерекшеленеді.","Белгілі бір кеңістікте генетикалық жүйе түзетін, бір түрге жататын және көбею арқылы өзін-өзі жаңғыртып отыратын организмдер тобын не деп атайды?",Популяция.,Factoid,bio,1,1,1,1,2,2,2,2,1,1,1,1,2,2,2,2.0
"Биосфера- тірі организмдер өмір сүретін жер қабаты.Биосфера негізінен үш қабаттан құрылады. Олар: атмосфера (газ күйіндегі), гидросфера (су), литосфера (қатты) қабаттары.",Биосфера неше қабаттан тұрады?,Үш.,Factoid,bio,1,1,1,1,2,2,2,2,1,1,1,1,2,2,2,2.0
"Нуклеин қышқылдары − тірі организмдегі тұқым қуалайтын ақпараттарды сақтай отырып, оны келесі ұрпақтарға жеткізетін күрделі құрылысты молекула. 1868 жылы швейцариялық биохимик Ф. Мишер оны алғаш рет жасуша ядросынан тапқандықтан нуклеин қышқылы деп атады.",Нуклеин қышқылы дегеніміз не?,"Тірі организмдегі тұқым қуалайтын ақпараттарды сақтай отырып, оны келесі ұрпақтарға жеткізетін күрделі құрылысты молекула.",Factoid,bio,1,1,1,0,2,2,2,2,1,1,1,0,2,2,2,2.0
"Рибонуклеин қышқылы (РНҚ) — жоғары молекулалық байланыс нуклеин қышқылдарының типі. Табиғатта кеңінен таралған. РНҚ-ның көмірсу бөлігінде рибоза қанты, ал азотты негіздері ретінде аденин, гуанин, цитозин және урацил болады.",Рибонуклеин қышқылының азотты негізінде не болады?,"Аденин, гуанин, цитозин және урацил болады.",Factoid,bio,1,1,1,1,2,2,2,2,1,1,1,1,2,2,2,2.0
"Дезоксирибонуклеин қышқылы (ДНҚ) – барлық тірі клеткалардың негізгі генетикалық материалы болып табылатын күрделі биополимер. ДНҚ-ның негізгі құрылымдық бірлігі – үш бөліктен құралған нуклеотид. Бірінші бөлігі – дезоксирибоза (бескөміртекті қант) , екіншісі – пуриндік негіздер: аденин (А) мен гуанин (Г) және пиримидиндік негіздер: тимин (Т) мен цитозин (Ц),  үшіншісі – фосфор қышқылының қалдығы.",Дезоксирибонуклеин қышқылы деген не?,Барлық тірі клеткалардың негізгі генетикалық материалы болып табылатын күрделі биополимер.,Factoid,bio,1,1,1,0,2,2,2,2,1,1,1,0,2,2,2,2.0
"Еуразияның жер бедері алуан түрлі. Еуразияның теңіз деңгейінен орташа биіктігі 840 м, оның ауданының жартысынан астамын таулар құрайды. Памир тауында Еуразиядағы ең ірі Федченко мұздығы орналасқан. Мұздықтың ұзындығы 77 шақырым. Тау басындағы мұздықтардан ірі өзендер бастау алады.",Федченко мұздығы қайда орналасқан?,Еуразия жер бедеріндегі Памир тауында.,Factoid,geo,1,1,1,1,2,2,2,2,1,1,1,1,2,2,2,2.0
Адамдар Камчатка мен Исландиядағы гейзер суын үйлерді жылытуға пайдаланады.,Адамдар Камчатка мен Исландиядағы гейзер суын не үшін пайдаланады?,үйлерді жылыту үшін,Factoid,geo,1,1,1,1,2,2,2,2,1,1,1,1,2,2,2,2.0
"Еуразиядағы ең биік сөнбеген жанартау Ключи Шоқысы, оның биіктігі 4750 м. Камчатка түбегінде орналасқан. Камчаткада әйгілі Гейзерлер аңғары орналасқан. Адамдар Камчатка мен Исландиядағы гейзер суын үйлерді жылытуға пайдаланады.",Ключи шоқысының биіктігі?,4750 м.,Factoid,geo,1,1,1,1,2,2,2,2,1,1,1,1,2,2,2,2.0
"Еуразиядағы ең биік сөнбеген жанартау Ключи Шоқысы, оның биіктігі 4750 м. Камчатка түбегінде орналасқан. Камчаткада әйгілі Гейзерлер аңғары орналасқан. Адамдар Камчатка мен Исландиядағы гейзер суын үйлерді жылытуға пайдаланады.",Еуразиядағы ең биік сөнбеген жанартау? ,Ключи Шоқысы,Factoid,geo,1,1,1,1,2,2,2,2,1,1,1,1,2,2,2,2.0
"Солтүстік Американың ең биік нүктесі Кордильер тауының солтүстігінде орналасқан Мак-Кинли шыңы, оның биіктігі 6193 м. Кордильер испан тілінен (Кордильера) аударғанда тау жотасы, тау тізбегі деген мағына береді.",Солтүстік Американың ең биік нүктесі бұл?,Кордильер тауының солтүстігінде орналасқан Мак-Кинли шыңы,Factoid,geo,1,1,1,1,2,2,2,2,1,1,1,1,2,2,2,2.0
"Атлант мұхиты алабының басты өзені – Миссисипи, Солтүстік Америкадағы ең суы мол өзен болып саналады. Миссисипи атауы үндістер тілінде су атасы деген мағына береді. Миссисипи өзені ұзындығы жөнінен Ніл өзені мен Амазонкадан кейінгі үшінші орынды алады.",Миссисипи өзені ұзындығы бойынша нешінші орында?,Үшінші.,Factoid,geo,1,1,1,1,2,2,2,2,1,1,1,1,2,2,2,2.0
Мадагаскар аралы Африка платформасынан ертеректе ажыраған бөлігі болып саналады. Мадагаскар аралында маймылдардың ерекше тобын құрайтын шағын денелі лемурлардың 26 түрі мекендейді. Сонымен қатар Мадагаскарда пальманың желпуіш тәрізді ерекше түрі – саяхатшылар ағашы кең таралған. Лемур мен саяхатшылар ағашы – Мадагаскар аралының символы.,Мадагаскар аралының символы нелер?,Лемур мен саяхатшылар ағашы.,Factoid,geo,1,1,1,1,2,2,2,2,1,1,1,1,2,2,2,2.0
"Аустралия – Жер шарындағы ең кіші материк. Аустралия жер көлемі жөнінен жер шарында алтыншы орынға ие. Материктің ауданы, маңындағы аралдармен қоса есептегенде, 7,6 млн шаршы шақырым.",Аустралия материгінің ауданы қандай?,"7,6 млн шаршы шақырым.",Factoid,geo,1,1,1,1,2,2,2,2,1,1,1,1,2,2,2,2.0
Дүниежүзілік мұхиттың ең терең бөлігі Мариан шұңғымасы Тынық мұхитта. Мариан шұңғымасының тереңдігі 11022 м. Мариан шұңғымасы Тынық мұхитының ең үлкен теңізі – Филиппин теңізінде орналасқан.,Дүниежүзілік мұхиттың ең терең бөлігі қай мұхитта орналасқан?,Тыңық мұхитта,Factoid,geo,1,1,1,1,2,2,2,2,1,1,1,1,2,2,2,2.0
Дүниежүзілік мұхиттың ең терең бөлігі Мариан шұңғымасы Тынық мұхитта. Мариан шұңғымасының тереңдігі 11022 м. Мариан шұңғымасы Тынық мұхитының ең үлкен теңізі – Филиппин теңізінде орналасқан.,Дүниежүзілік мұхиттың ең терең бөлігі қайда орналасқан?,Филиппин теңізінде.,Factoid,geo,1,1,1,1,2,2,2,2,1,1,1,1,2,2,2,2.0
"Антарктиданың ең биік нүктесі Винсон тауы, оның биіктігі 5140 м. Антарктидада таулардың тек ең биік шыңдары ғана жер бетіне шығып жатады, ал қалған бөлігі қалың мұз қабатының астында жатыр.",Антарктиданың ең биік нүктесі қалай аталады және оның биіктігі қанша?,"Винсон тауы, 5140 м.",Factoid,geo,1,1,1,1,2,2,2,2,1,1,1,1,2,2,2,2.0
"Антарктидада табиғатының қаталдығына байланысты өсімдіктер мен жануарлар жоқ десе де болады.Антарктида жағалауында құстардың ерекше түрі пингвиндер көп таралған.Олардың 17 түрі кездеседі, ең көп тарағаны Адели деп аталатын кішкене пингвин.",Антарктидада ең көп тараған пингвин түрі қандай?,Адели.,Factoid,geo,1,1,1,1,2,2,2,2,1,1,1,1,2,2,2,2.0
"Урбандалу латын тілінен аударғанда қалалану деген мағына береді. Урбандалу дегеніміз қалалардың өсуі мен қала халқының санының өсуі. Урбандалу деңгейі Қытайда 45% болса, Кувейтте 98%-ды құрайды.",Урбандалу бұл?,Қалалардың өсуі мен қала халқының санының өсуі.,Factoid,geo,1,1,1,1,2,1,2,2,1,1,1,1,2,1,2,2.0
Агломерация дегеніміз – ірі қаланың маңына орташа және шағын қалалардың шоғырлануы. Қазақстандағы ең ірі агломерациясы Қарағанды-Теміртау агломерациясы. Жақын орналасқан агломерациялардың бірігуінен мегаполистер қалыптасады (Алматы мегаполисі).,Агломерация деген не?,Ірі қаланың маңына орташа және шағын қалалардың шоғырлануы.,Factoid,geo,1,1,1,0,2,2,2,2,1,1,1,0,2,2,2,2.0
Адамзат тарихындағы ең алғашқы су электр стансылары XIX ғасырдың соңында Германиядағы Неккар өзені мен Ұлыбританиядағы Темза өзендерінде салынған.,Ең алғашқы су электр стансылары қандай өзендерде салынған?,Германиядағы Неккар өзені мен Ұлыбританиядағы Темза өзендерінде.,Factoid,geo,1,1,1,1,2,2,2,1,1,1,1,1,2,2,2,1.0
Жүгерінің Отаны – Оңтүстік Америка. Жүгері Х.Колумбтың саяхатынан кейін дүниежүзіне таралған. Әлем бойынша жүгері өндіруші жетекші ел АҚШ болып саналады. Дүниежүзі бойынша жүгерінің 50% -ы АҚШ-та өсіріледі.,Жүгерінің отаны қай жер?,Оңтүстік Америка.,Factoid,geo,1,1,1,1,2,2,2,2,1,1,1,1,2,2,2,2.0
"Табиғи каучукты гевея ағашынан алады. Табиғи каучук өндіруден Азиядағы Тайланд, Индонезия, Малайзия көзге түседі.",Табиғи каучук алынатын ағаш?,Гевея ағашы.,Factoid,geo,1,1,1,1,2,2,2,2,1,1,1,1,2,2,2,2.0
"Канал – адамның қолымен жасалған өзен. Халықаралық саудада маңызы зор каналдар – Панама, Суэц каналдары. Суэц каналы Египет мемлекетінің меншігі болып саналады. Каналдың тереңдігі 16,2 м, ұзындығы 161 шақырым. Канал Жерорта теңізі мен Қызыл теңізді байланыстырады.",Адамның қолымен жасалған өзенді қалай атайды?,Канал.,Factoid,geo,1,1,1,1,2,2,2,2,1,1,1,1,2,2,2,2.0
Украинадағы ең ірі өзен – Днепр өзені. Бұл өзеннің Украинадағы ұзындығы 981 шақырымды құрайды. Украинадағы өзендердің көпшілігі Қара теңіз бен Азов теңізі алаптарына жатады.,Украинадағы ең ірі өзен?,Днепр.,Factoid,geo,1,1,1,1,2,2,2,2,1,1,1,1,2,2,2,2.0
"«Теоцентризм» (грек. theos – құдай) деп аталатын бұл көзқарас бойынша бүкіл дүниені, соның ішінде адамды да құдай жаратқан. Ал құдайдың құдіретіне шек жоқ, олай болса, адамның жаратылыс сыры тылсым, құпия, оны рационалды жолмен танып-білу мүмкін емес, тек жүрекпен түйсіну керек делінді.",Теоцентризм деген не?,"Бүкіл дүниені, соның ішінде адамды да құдай жаратқан деген көзқарас.",Factoid,history,1,1,1,0,2,2,2,2,1,1,1,0,2,2,2,2.0
Көшкіндер - ауырлық күші әсерінен беткей бойымен тау жыныс массасының төменге қарай жылжуы. Көшкіндер жер асты сулары немесе жауын-шашынның тау жыныстарының тепе-теңдігін бұзу нәтижесінде пайда болады.,Көшкін деген не?,Ауырлық күші әсерінен беткей бойымен тау жыныс массасының төменге қарай жылжуы.,Factoid,history,1,1,1,0,2,2,2,2,1,1,1,0,2,2,2,2.0
"Карталардың түптелген жиынтығы – атластар деп аталады.Атлас карталары бірін-бірі толықтыратын, форматы мен проекциялары ортақ, масштабы жағынан біртектес болып келеді. Олар: географиялық, жұлдыздар жəне жекелеген аспан денелері атластары деп бөлінеді.",Атластар қандай түрлерге бөлінеді?,"географиялық, жұлдыздар жəне жекелеген аспан денелері атластары",Factoid,geo,1,1,1,0,2,2,2,2,1,1,1,0,2,2,2,2.0
"Карталардың түптелген жиынтығы – атластар деп аталады.Атлас карталары бірін-бірі толықтыратын, форматы мен проекциялары ортақ, масштабы жағынан біртектес болып келеді. Олар: географиялық, жұлдыздар жəне жекелеген аспан денелері атластары деп бөлінеді.",Карталардың түптелген жиынтығы нелер?,Атластар,Factoid,geo,1,1,1,1,2,2,2,2,1,1,1,1,2,2,2,2.0
Мадагаскар – Африканың ең ірі аралы. Мадагаскар аралында малагасийлер тұрады. Малагасий қара және моңғол нәсілінің араласуынан пайда болған халық.,Мадагаскар халқы қалай аталады?,Малагасийлер,Factoid,geo,1,1,1,1,2,2,2,2,1,1,1,1,2,2,2,2.0
Мадагаскар – Африканың ең ірі аралы. Мадагаскар аралында малагасийлер тұрады. Малагасий қара және моңғол нәсілінің араласуынан пайда болған халық.,Африкадағы ең үлкен арал қалай аталады?,Мадагаскар,Factoid,geo,1,1,1,1,2,2,2,2,1,1,1,1,2,2,2,2.0
Парсы шығанағындағы аралдық мемлекет – Бахрейн. Бахрейннің астанасы –Манама қаласы.,Парсы шығанағындағы аралдық мемлекет?,Бахрейн.,Factoid,geo,1,1,1,1,2,2,2,2,1,1,1,1,2,2,2,2.0
"Левенгук амикроорганизмдер дүниесін зерттеуге, микробиологияның дамуына жол ашты. Микробиология (грекше «микрос» – кішкене, «логос» – ғылым) – көзге көрінбейтін, ұсақ тірі ағзалардың құрылысын, қасиеттерін, пайдасы мен зиянын зерттейтін ғылым.",Микробиология дегеніміз не?,"Көзге көрінбейтін, ұсақ тірі ағзалардың құрылысын, қасиеттерін, пайдасы мен зиянын зерттейтін ғылым.",Factoid,bio,1,1,1,0,2,2,2,2,1,1,1,0,2,2,2,2.0
"Бактериялардың көптеген түрі өсімдіктерді де зақымдайды, ол ауруды бактериоз дейді. Олар бау-бақша, техникалық жеміс-жидек өсімдіктерін зақымдап, зор нұқсан келтіреді.",Бактериоз дегеніміз не?,Бактериялардың көптеген түрі өсімдіктерді де зақымдайтын ауру.,Factoid,bio,1,1,1,0,2,2,2,2,1,1,1,0,2,2,2,2.0
"Бактериялар мақта өсімдігінде гоммоз (шайыр ағу) ауруын туғызады. Мақта тұқымында сақталған бактерия спорасы тұқыммен бірге өнеді. Мақта сабағын, жапырағын, қауашағын зақымдайды да, ірі қошқыл қоңыр түсті дақтар пайда болады.",Мақта өсімідігінде ауру туғызатын бактерия?,Гоммоз.,Factoid,bio,1,1,1,1,2,2,1,2,1,1,1,1,2,2,1,2.0
Спора – саңырауқұлақтардың таралуын қамтамасыз ететін арнайы құрылымды жасуша. Споралар түзілетін орын спорангий деп аталады.,Спорангий деген не?,Споралар түзілетін орын.,Factoid,bio,1,1,1,0,2,2,2,2,1,1,1,0,2,2,2,2.0
"Саңырауқұлақтар мен бактериялар топырақ құрамындағы кейбір зиянды бактериялардың көбейіп кетпеуіне ықпал етеді. Өздерінен арнайы зат бөліп, зиянды бактериялардың өсуін тежейді. Оларды антибиотиктер деп атайды.",Антибиотиктер дегеніміз не?,"Өздерінен арнайы зат бөліп, зиянды бактериялардың өсуін тежейтін заттар.",Factoid,bio,1,1,1,0,2,2,2,2,1,1,1,0,2,2,2,2.0
"Тарғақ, орақтұмсық және реликті шағалалар (қарамойнақ) Қызыл кітап тізімінде бар. Реликті шағала Қазақстанда Алакөл көлінде ғана таралған. Қорғау мақсатында Алакөл қорығы (1998) ұйымдастырылды.",Реликті шағала Қазақстанның қай аймағында таралған?,Алакөл көлінде.,Factoid,bio,1,1,1,1,2,2,2,2,1,1,1,1,2,2,2,2.0
"Адам есту мүшесі арқылы қоршаған ортадан әр түрлі дыбыстарды қабылдап талдайды. Есту мүшесі дыбыстарды анықтап ажыратуға көмектеседі. Адамның есту мүшесі – құлақ. Құлақ 3 бөлімнен тұрады: сыртқы, ортаңғы және ішкі құлақ.",Құлақ қандай бөліктерден тұрады?,"Сыртқы, ортаңғы және ішкі құлақ.",Factoid,bio,1,1,1,1,2,2,2,2,1,1,1,1,2,2,2,2.0
