Context,Question,Answer,Question_type,Domain,Annotator1_QuestionObjective,Annotator1_ContextRelevant,Annotator1_DomainAgree,Annotator1_QuestionTypeAgree,Annotator1_AnswerCorrect,Annotator1_AnswerComplete,Annotator1_QuestionCorrect,Annotator1_QuestionComplete,Annotator2_QuestionObjective,Annotator2_ContextRelevant,Annotator2_DomainAgree,Annotator2_QuestionTypeAgree,Annotator2_AnswerCorrect,Annotator2_AnswerComplete,Annotator2_QuestionCorrect,Annotator2_QuestionComplete
Шоқан (шын аты Мұхаммед Қанафия) Шыңғысұлы Уәлиханов – Абылай ханның шөбересі. Әкесі Шыңғыс – ел билеуші аға сұлтан болған әйгілі адам.,Шоқанның шын аты?,Мұхаммед Қанафия,Factoid,biblio,1,1,1,1,2,2,1,2,1,1,1,1,2,2,1,2.0
Абайды сөз өнеріне ерте баулыған адам – ​​әжесі Зере. Ол немересінде білімге деген сүйіспеншілік пен құштарлықты оята алды.,Абайды сөз өнеріне ерте баулыған адам кім?,әжесі Зере,Factoid,biblio,1,1,1,1,2,2,2,2,1,1,1,1,2,2,2,2.0
"А.Құнанбайұлы 170-ке жуық өлеңнің авторы. Сонымен қатар, орыстың ұлы ақындарының шығармаларын қазақ тіліне аударған. Ең маңызды өлеңдерін 40 жасында жаза бастады.",Абай ең маңызды өлеңдерін қанша жасында жаза бастады?,40,Factoid,biblio,0,1,1,1,2,2,2,2,0,1,1,1,2,2,2,2.0
"Абай 1886 жылға дейін өз шығармаларын Көкбай Жанатайұлы деген атпен жазған. Бұл адам – Абайдың жақын досы, әрі шәкірті болған.",Абай 1886 жылға дейін өз шығармаларын қандай атпен жазған?,Көкбай Жанатайұлы,Factoid,biblio,1,1,1,1,2,2,2,2,1,1,1,1,2,2,2,2.0
"Абайдың құрметіне аталған қалалар Қазақстанда ғана емес, сондай-ақ, Киевте, Ташкентте, Делиде, Каирде және тіпті Берлинде бар. Қазіргі уақытта, ұлы ойшылдың туындылары 60 тілге аударылған.",Қазіргі уақытта ұлы ойшылдың туындылары қанша тілге аударылған?,60,Factoid,biblio,0,1,1,1,2,2,2,2,0,1,1,1,2,2,2,2.0
"Есік ашар - дәстүр. Күйеу жігіт келіншегін алып, үйлену тойы өткен соң келісілген уақытта өзі қатарлас жас жігіттермен ата-енесінің үйіне келеді. Мұны халық әдебиетінде күйеудің алғаш, яғни, есік аша келуі дейді.",Есік ашар деген қандай дәстүр?,"Күйеу жігіт келіншегін алып,үйлену тойы өткен соң келісілген уақытта өзі қатарлас жас жігіттермен ата - енесінің  үйіне келеді. ",Factoid,eth0,1,1,1,0,2,2,2,2,1,1,1,0,2,2,2,2.0
"Көрімдік — бұл алғаш рет жаңа түскен келінді және жас сәбиді көргенде берілетін сыйлық. Көрімдікті беташарда, келіннің бетін көру үшін береді.",Көрімдік қай кезде беріледі?,Алғаш рет жаңа түскен келінді және жас сәбиді көргенде берілетін сыйлық.,Factoid,eth0,1,1,1,0,2,2,2,2,1,1,1,0,2,2,2,2.0
"Байғазы бала алғаш рет атқа мінгенде, жаңа киім алғанда беріледі.Яғни,  кішкентай балаларға, жасөспірімдерге үлкендердің беретін сыйлығы. ",Байғазы не үшін беріледі?,"Байғазы бала алғаш рет атқа мінгенде, жаңа киім алғанда беріледі.",Factoid,eth0,1,1,1,0,2,2,2,2,1,1,1,0,2,2,2,2.0
"«Сүйіншіні» қуанышты жаңалық айтқысы келгенде айтады. Қуанышты жаңалықты алып келген адамға, дәстүр бойынша міндетті түрде сыйлық беру керек.",Қуанышты жаңалық алып келген адамға сыйлық берілетін дәстүр түрі қалай аталады?,Сүйінші,Factoid,eth0,1,1,1,1,2,2,2,2,1,1,1,1,2,2,2,2.0
"Жиенқұрық — бұл қыздың балаларына берілетін сыйлық. Қызы туған балаларды жиен деп атайды. Дәстүр бойынша, анасының туыстары, жиен айтқан үш тілекті орындауы қажет.",Жиенқұйрық кімге берілетін сыйлық түрі?,қыздың балаларына берілетін сыйлық.,Factoid,eth0,1,1,1,0,2,2,2,2,1,1,1,0,2,2,2,2.0
Шашу - мерекелер кезінде кәмпит немесе ақша шашады. Үлкен кісілер тойларда кәмпит пен ақшаны міндетті түрде алу керек деп айтады. Олар қуаныш әкеледі дейді.,Қуаныш алып келеді деп сенетін ырым түрі қандай?,Шашу,Factoid,eth0,1,1,1,1,2,2,2,2,1,1,1,1,2,2,2,2.0
"Ежелгі заманнан қазақтар өздерінің ұлдарын сүндетке отырғызып,осыған орай той ұйымдастыратын. Бұл маңызды оқиға балалар үш жастағы, үш, бес немесе жеті жаста болған кезде өткізіледі.",Ежелден сүндетке балаларды қанша жаснан бастап отырғызған?,"Бұл маңызды оқиғаға балаларды үш,бес немесе жеті жаста болған кезінде өткізілген.",Factoid,eth0,1,1,1,1,2,2,1,2,1,1,1,1,2,2,1,2.0
"Әмеңгерлік – күйеуі қайтыс болып, жесір қалған әйелдің қайын ағасына немесе қайын інісіне, болмаса жұбайының ең жақын туыстарының біріне тұрмысқа шығуы, некелесуі. ",Әмеңгерлік деген қандай салт?,"күйеуі қайтыс болып, жесір қалған әйелдің қайын ағасына немесе қайын інісіне, болмаса жұбайының ең жақын туыстарының біріне тұрмысқа шығуы, некелесуі. ",Factoid,eth0,1,1,1,0,2,2,2,2,1,1,1,0,2,2,2,2.0
"Қазақстанның кей жерлерінде, көбіне маусымдық шөп шабу кезінде үмеге шақыру дәстүрі болған. Көмекке келгендерге берілетін ас үме деп аталған. ",Көмекке келгенде берілетін ас не деп аталады?,Үме ,Factoid,eth0,1,1,1,1,2,2,2,2,1,1,1,1,2,2,2,2.0
"Қыз ұзату салты кезінде құдалар тарапынан әкелінетін ең басты, жолы бөлек кәде сыйды сүт ақы дейді. ",Сүт ақы дегеніміз не?,"Қыз ұзату салты кезінде құдалар тарапынан әкелінетін ең басты, жолы бөлек кәде сый",Factoid,eth0,1,1,1,0,2,2,2,2,1,1,1,0,2,2,2,2.0
Адамзат тарихы дамуының ең алғашқы кезеңі тас дәуірі деп аталады.,Адамзат тарихы дамуының ең алғашқы кезеңі не деп аталды?,тас дәуірі,Factoid,history,1,1,1,1,2,2,2,2,1,1,1,1,2,2,2,2.0
Ғалымдардың ең ежелгі адамды епті адам деп аталған. Епті адам 1 млн. 750 мың жыл бұрын  өмір сүрген.,Епті адамның өмір сүрген уақыты?,1 млн. 750 мың жыл бұрын,Factoid,history,1,1,1,1,2,2,2,2,1,1,1,1,2,2,2,2.0
Жамбыл облысынан табылған палеолит дәуірінің бес мыңдай еңбек құралдарының бәрі қашау мен үшкір заттар.,Жамбыл облысынан табылған палеолит дәуірінің бес мыңдай еңбек құралдарының бәрі қандай заттар болды?,Қашау мен үшкір заттар,Factoid,history,1,1,1,1,2,2,2,2,1,1,1,1,2,2,2,2.0
ХVғ ІІ жартысында Шайбани ханға қарсы соғыста Әмір Темір әулеті Қазақ хандығымен одақ құрды.,ХVғ ІІ жартысында Шайбани ханға қарсы соғыста Қазақ хандығымен одақ құрған кім?,Әмір Темір әулеті,Factoid,history,1,1,1,1,2,2,2,2,1,1,1,1,2,2,2,2.0
Әбілмансұрдың атасы Абылай Қай жерде билік құрды?,Әбілмансұрдың атасы Абылай Қай жерде билік құрды?,Түркістанда,Factoid,history,1,1,1,1,2,2,2,2,1,1,1,1,2,2,2,2.0
Жеті жарғы бойынша xандықтың ішкі өмірі мен сыртқы саяси өмірінің аса маңызды мәселелерін билер шешетін болған.,Жеті жарғы  бойынша xандықтың ішкі өмірі мен сыртқы саяси өмірінің аса маңызды мәселелерін кімдер  шешетін болған?,Билер,Factoid,history,1,1,1,1,2,2,2,2,1,1,1,1,2,2,2,2.0
Қазақ КСР-нің мемлекеттік егемендігі туралы Декларация 1990 жылы 25 қазан қабылданды.,Қазақ КСР-нің мемлекеттік егемендігі туралы Декларация қашан  қабылданды?,1990 жылы 25 қазанда,Factoid,history,1,1,1,1,2,2,2,2,1,1,1,1,2,2,2,2.0
Қаракерей Қабанбай туралы жазылған Қ.Жұмаділовтің диалогиясы Дарабоз деп аталады.,Қаракерей Қабанбай туралы жазылған диалогия не деп аталады?,Дарабоз,Factoid,history,1,1,1,1,2,2,2,2,1,1,1,1,2,2,2,2.0
960ж Қараxан мемлекеті Исламды мемлекеттік дін деп жариялаған Қазақстандағы ерте ортағасырлық мемлекет болды.,960 жылы Исламды мемлекеттік дін деп жариялаған Қазақстандағы ерте ортағасырлық қай мемлекет ?,Қарахан мемлекеті,Factoid,history,1,1,1,1,2,2,2,2,1,1,1,1,2,2,2,2.0
Патша өкіметінің саясатына қарсылық білдіргені үшін қоғам қайраткері А.Байтұрсынов 1909 жылы Семей түрмесіне қамалған.,Патша өкіметінің саясатына қарсылық білдіргені үшін қоғам қайраткері А.Байтұрсынов қай жылы Семей түрмесіне қамалды?,1909,Factoid,history,1,1,1,1,2,2,2,2,1,1,1,1,2,2,2,2.0
1838 жылы мамырда Кенесары сарбаздары Ақмола бекінісін өртеп жіберді.,Кенесары сарбаздары Ақмола бекінісін қай жылы өртеп жіберді?,1838,Factoid,history,1,1,1,1,2,2,2,2,1,1,1,1,2,2,2,2.0
1906 жылы  10 қаңтарда Ішкі істер министрі Дурнов Қазақстандағы қарсылықтарды басуға тапсырма берді.,1906 жылы  10 қаңтарда кім Қазақстандағы қарсылықтарды басуға тапсырма берді?,Дурнов,Factoid,history,1,1,1,1,2,2,2,2,1,1,1,1,2,2,2,2.0
Азамат соғысы жылдарында Ыбыраев Кеңарал болысында астыртын жұмысты ұйымдастырды.,Азамат соғысы жылдарында кім Кеңарал болысында астыртын жұмысты ұйымдастырды?,Ыбыраев,Factoid,history,1,1,1,1,2,2,2,2,1,1,1,1,2,2,2,2.0
1960 жылы Кентау қаласында трансформатор зауыты салынды.,Қай жылы Кентау қаласында трансформатор зауыты салынды?,1960 жылы,Factoid,history,1,1,1,1,2,2,2,2,1,1,1,1,2,2,2,2.0
"Гректер Сақтарды Әлемдегі ең әділ,ең шыншыл xалық деп есептегендер болды.","Сақтарды Әлемдегі ең әділ,ең шыншыл xалық деп есептеген кімдер?",Гректер,Factoid,history,1,1,1,1,2,2,2,2,1,1,1,1,2,2,2,2.0
"1757 жылы Қытай қолбасшысы Фу Дэ, Чжао Хой басқарған Қытай әскері қазақ жеріне басып кірді.","Қытай қолбасшысы Фу Дэ, Чжао Хой басқарған Қытай әскері қазақ жеріне қай жылы басып кірді?",1757 жылы,Factoid,history,1,1,1,1,2,2,2,2,1,1,1,1,2,2,2,2.0
Сібір қазақтарының Ережесі бойынша 50-70 шаңырақтан  ауыл құралды.,Сібір қазақтарының Ережесі бойынша қанша шаңырақтан  ауыл құралды?,50-70 шаңырақтан,Factoid,eth0,1,1,1,1,2,2,2,2,1,1,1,1,2,2,2,2.0
"Қазақ xалқының жүзге бөлінуі, қазақ мемлекеті шұрылғаннан кейінгі кезде өз жерін қорғау қажеттілігінен туған-деп жазған қазақтың тұңғыш ағартушы ғалым Шоқан Уәлиханов болды.","Қазақ xалқының жүзге бөлінуі, қазақ мемлекеті шұрылғаннан кейінгі кезде өз жерін қорғау қажеттілігінен туған-деп жазған қазақтың тұңғыш ағартушы ғалым кім?",Шоқан Уәлиханов,Factoid,history,1,1,1,1,2,2,2,2,1,1,1,1,2,2,2,2.0
Ресей бодандығын 1817 жылы бірінші болып қабылданған Ұлы жүздің руы Жалайыр.,Ресей бодандығын 1817 жылы бірінші болып қабылданған қай ру?,Ұлы жүздің руы Жалайыр,Factoid,history,1,1,1,1,2,2,2,2,1,1,1,1,2,2,2,2.0
Қазақстан аумағындағы Неміс автономиялық облысын құру жөніндегі шешім 1978 жылы  көктемде қабылданды.,1978 жылы көктемде қандай оқиға болды?,Қазақстан аумағындағы Неміс автономиялық облысын құру жөніндегі шешім қабылданды,Factoid,history,1,1,1,0,2,2,2,2,1,1,1,0,2,2,2,2.0
Альберт Эйнштейн. Болашақ ғалым 1879 жылы наурызда Германияның Ульм қаласында дүниеге келген.,Эйнштейн қай жерде дүниеге келген?,Германияның Ульм қаласында,Factoid,physics,1,1,1,1,2,2,2,2,1,1,1,1,2,2,2,2.0
Альберт Эйнштейн. Болашақ ғалым 1879 жылы наурызда Германияның Ульм қаласында дүниеге келген.,Эйнштейн қай жылы дүниеге келген?,1979,Factoid,physics,1,1,1,1,2,2,2,2,1,1,1,1,2,2,2,2.0
Альберт Эйнштейн. Болашақ ғалым 1879 жылы наурызда Германияның Ульм қаласында дүниеге келген.,Альберт Эйнштейн қай айда дүниеге келген?,наурызда,Factoid,physics,1,1,1,1,2,2,2,2,1,1,1,1,2,2,2,2.0
Альберт Эйнштейн. Болашақ ғалым 1879 жылы наурызда Германияның Ульм қаласында дүниеге келген.,Альберт Эйнштейн ғалым ба?,ғалым,Factoid,physics,1,1,1,1,2,2,2,2,1,1,1,1,2,2,2,2.0
"Көптеген танымал физиктер сияқты, Лев Ландау теориялық салада ең жарқын көрініс тапты. Аңызға айналған кеңес ғалымы 1908 жылдың қаңтарында инженер және дәрігер отбасында дүниеге келді.",Лев Ландау қай жылы дүниеге келген?,1908,Factoid,physics,1,1,1,1,2,2,2,2,1,1,1,1,2,2,2,2.0
"Көптеген танымал физиктер сияқты, Лев Ландау теориялық салада ең жарқын көрініс тапты. Аңызға айналған кеңес ғалымы 1908 жылдың қаңтарында инженер және дәрігер отбасында дүниеге келді.",Лев Ландау қай елдің ғалымы?,Кеңес,Factoid,physics,1,1,1,1,2,2,2,2,1,1,1,1,2,2,2,2.0
"Ландаудың жетістіктері Нобель сыйлығымен ерекшеленді, сонымен қатар кеңес ғалымы бірнеше Сталиндік сыйлықты алды. ",Ландаудың жетістіктері қандай сыйлықтармен ерекшеленді?,Нобель сыйлығы сонымен қатар бірнеше Сталиндік сыйлығы,Factoid,physics,1,1,1,1,2,2,2,2,1,1,1,1,2,2,2,2.0
Джеймс Клерк Максвелл классикалық электродинамиканы дамытқан британдық ғалым.,Джеймс Клерк Максвелл нені дамытқан?,классикалық электродинамика,Factoid,physics,1,1,1,1,2,2,2,2,1,1,1,1,2,2,2,2.0
Джеймс Клерк Максвелл классикалық электродинамиканы дамытқан британдық ғалым.,Максвелл қай елдің ғалымы?,британдық,Factoid,physics,1,1,1,0,2,2,2,2,1,1,1,0,2,2,2,2.0
"Атом бүтіндей алғанда зарядсыз, бейтарап бөлшек.",Атом деген не?,"Зарядсыз, бейтарап бөлшек.",Factoid,physics,1,1,1,0,2,2,2,2,1,1,1,0,2,2,2,2.0
"Катод(грекше kathodos – төмен түсу, қайту) – теріс зарядты электрод.",Катод деген не?,теріс зарядты электрод,Factoid,physics,1,1,1,0,2,2,2,2,1,1,1,0,2,2,2,2.0
"Вакуум (лат. vacuum — қуыс, бостық) — кеңістіктің еш заттегісіз күйі.",Вакуум деген не?,кеңістіктің еш заттегісіз күйі,Factoid,physics,1,1,1,0,2,2,2,2,1,1,1,0,2,2,2,2.0
Барометр — атмосфералық қысымды өлшеуге арналған құрал. Ең көп таралғаны — сынапты барометрлер.,Барометр деген не?,атмосфералық қысымды өлшеуге арналған құрал.,Factoid,physics,1,1,1,0,2,2,2,2,1,1,1,0,2,2,2,2.0
"Паскаль (Француз ғалымы Pascal құрметіне қойылған) — бірліктердің Халықаралық жүйесіндегі қысымның, механикалық кернеудің бірлігі. ",Паскаль деген не?,"бірліктердің Халықаралық жүйесіндегі қысымның, механикалық кернеудің бірлігі. ",Factoid,physics,1,1,1,0,2,2,2,2,1,1,1,0,2,2,2,2.0
"Атом өте ұсақ бөлшек болғандықтан, ондағы электронның қозғалысы микродүниенің қозғалу заңдылықтарына бағынады.",Атомдағы электронның қозғалысы неге бағынады?,микродүниенің қозғалу заңдылықтарына,Factoid,physics,1,1,1,1,2,2,2,2,1,1,1,1,2,2,2,2.0
"Кереге – киіз үй сүйегінің қабырғалық бөлігі, талдан, жіңішке қайыңнан жасалады.",Кереге деген не?,киіз үй сүйегінің қабырғалық бөлігі,Factoid,eth0,1,1,1,0,2,2,2,2,1,1,1,0,2,2,2,2.0
Шаңырақ — киіз үй күмбезін кереге көзді крестімен дөңгелек ішінде қоршалана аяқталған конструктивті элемент. Шаңырақ - киіз үйдің ең жоғарғы бөлігі. ,Шаңырақ деген не?,киіз үйдің ең жоғарғы бөлігі. ,Factoid,eth0,1,1,1,0,2,2,2,2,1,1,1,0,2,2,2,2.0
"Күмбез — жалпы жобасы шеңберленіп келген (кейде көп қырлы, эллипске ұқсас, т.б.) ғимараттар мен құрылыстардың төбесін жабула қолданатын конструкциялық элементтердің бір түрі.",Күмбез деген не?,ғимараттар мен құрылыстардың төбесін жабула қолданатын конструкциялық элемент,Factoid,eth0,1,1,1,0,2,2,2,2,1,1,1,0,2,2,2,2.0
Байт -  дерек көлемін өлшеу бірлігі. Сегіз биттен тұратын топ.,Байт деген не?,дерек көлемін өлшеу бірлігі,Factoid,IT,1,1,1,0,2,2,2,2,1,1,1,0,2,2,2,2.0
Байт -  дерек көлемін өлшеу бірлігі. Сегіз биттен тұратын топ.,Байт неше биттен тұратын топ?,Сегіз,Factoid,IT,1,1,1,1,2,2,2,2,1,1,1,1,2,2,2,2.0
"Килобайт  — дерек көлемін өлшеу бірлігі, бір килобайт 1024 байтқа тең.",Бір килобайт неше байтқа тең?,1024,Factoid,IT,1,1,1,1,2,2,2,2,1,1,1,1,2,2,2,2.0
"Мегабайт  — дерек көлемін өлшеу бірлігі, бір мегабайт 1024 килобайтқа тең.",Бір мегабайт неше килобайтқа тең?, ,Factoid,IT,1,1,1,1,2,2,2,2,1,1,1,1,2,2,2,2.0
Әлемдегі ең алғашқы сайт Info.cern.ch 1990 жылы пайда болды. Сайтты жасаған Тим Бернерс-Ли.,Әлемдегі ең алғашқы сайтты жасаған кім?,Тим Бернерс-Ли,Factoid,IT,1,1,1,1,2,2,2,2,1,1,1,1,2,2,2,2.0
"Google іздеу жүйесі PDF, RTF, PostScript, Microsoft Word, Microsoft Excel, Microsoft PowerPoint және т.б. форматтағы құжаттарды тауып беру мүмкіндігіне ие.",Google деген не?,іздеу жүйесі,Factoid,IT,1,1,1,0,2,2,2,2,1,1,1,0,2,2,2,2.0
Portable Document Format (PDF) — Adobe Systems фирмасы тарапынан PostScript тілінің бірқатар мүмкіндіктерін қолдана отырып жасаған электронды құжаттардың кросстұғырлы форматы.,PDF деген не?,электронды құжаттардың кросстұғырлы форматы,Factoid,IT,1,1,1,0,2,2,2,2,1,1,1,0,2,2,2,2.0
"Сыбаға – құрметті қонаққа немесе жақын-жуыққа арнап сақталған кәделі ет мүшелері, тағам. Мәселен ақсақалдарға, құдаларға, жолы үлкен адамдарға бас, жамбас, жая, ірі малдың омыртқалары сияқты мүшелері тартылады.",Сыбаға деген не?,құрметті қонаққа немесе жақын-жуыққа арнап сақталған кәделі ет мүшелері,Factoid,IT,1,1,1,0,2,2,2,2,1,1,1,0,2,2,2,2.0
"Сыбаға – құрметті қонаққа немесе жақын-жуыққа арнап сақталған кәделі ет мүшелері, тағам. Мәселен ақсақалдарға, құдаларға, жолы үлкен адамдарға бас, жамбас, жая, ірі малдың омыртқалары сияқты мүшелері тартылады.",Еттің қандай мүшелері сыбаға ретінде тартылалы?,"бас, жамбас, жая, ірі малдың омыртқалары",Factoid,eth0,0,1,1,1,2,2,2,2,0,1,1,1,2,2,2,2.0
