Context,Question,Answer,Question_type,Domain,Annotator1_QuestionObjective,Annotator1_ContextRelevant,Annotator1_DomainAgree,Annotator1_QuestionTypeAgree,Annotator1_AnswerCorrect,Annotator1_AnswerComplete,Annotator1_QuestionCorrect,Annotator1_QuestionComplete,Annotator2_QuestionObjective,Annotator2_ContextRelevant,Annotator2_DomainAgree,Annotator2_QuestionTypeAgree,Annotator2_AnswerCorrect,Annotator2_AnswerComplete,Annotator2_QuestionCorrect,Annotator2_QuestionComplete
1856 жылы қазіргі Тараз орнындағы көне қалаға Қарахан әулетінің негізін қалаушы Сатұқ Боғраханның құрметіне Әулие-Ата деген атау берілді. 1936 жылдан бастап Мирзоян аталды.,1936 жылға дейін Әулие-Ата аталған қала?,Тараз,Factoid,history,1,1,1,1,2,2,2,2,1,1,1,1,2,2,2,2.0
Түркістанда көптің орнына кейде енапат сөзін қолданады.,Түркістан облысындағылар үшін көп мағынасын беретін сөз,енапат,Factoid,eth0,1,1,1,1,2,2,2,2,1,1,1,1,2,2,2,2.0
Көкшетау өңірі ет қамырын құлақнан деп айтады.,Көкшетауда құлақнан қандай мағына береді?,ет қамыры,Factoid,eth0,1,1,1,1,2,2,2,2,1,1,1,1,2,2,2,2.0
Солтүстік Қазақстанда шайды қайнататын ыдысты ақман деп айтады.,Солтүстік Қазақстан шайды қандай ыдыста қайнатып береді?,ақман,Factoid,eth0,1,1,1,1,2,2,2,2,1,1,1,1,2,2,2,2.0
Өскеменде сағызды шайыр деп те айтады.,Шайыр шайнайтын қай аймақ?,Өскемен,Factoid,eth0,1,1,1,1,2,2,2,2,1,1,1,1,2,2,2,2.0
Пиязды Семей өңірінде сарымсақ деп айтады.,Нені Семей өңірінде сарымсақ деп айтады?,пиязды,Factoid,eth0,1,1,1,1,2,2,2,2,1,1,1,1,2,2,2,2.0
Кіттей сөзі Өскемен аймағында кішкентай мағынасын береді.,Өскеменнің кішкентайын табыңыз,кіттей,Factoid,eth0,1,1,1,1,2,2,2,0,1,1,1,1,2,2,2,0.0
Гете мен Абай ғылыми очерк-эссесі - жазушы Герольд Бельгердің еңбегі.,Гете мен Абай кітабының авторы,Герольд Бельгер,Factoid,biblio,1,1,1,1,2,2,1,2,1,1,1,1,2,2,1,2.0
Абай Айналайын құдай-ау деп басталатын жоқтау-өлеңі ұлы Әбдірахман қайтыс болғанда жазған.,Абайдың Айналайын құдай-ау деп басталатын жоқтау-өлеңі кімге арналды?,Ұлы Әбдірахманға,Factoid,biblio,1,1,1,1,2,2,2,2,1,1,1,1,2,2,2,2.0
Ақынның шығармашылық-күрескерлік қызметін музыка тілімен баяндайтын Абай сюитасын 1941 жылы Ахмет Жұбанов жазды.,"1941 жылы жазылған Абай атты 5 бөлімді лирикалық-драмалық шығарманың авторы, композитор",Ахмет Жұбанов,Factoid,biblio,1,1,1,1,2,2,1,2,1,1,1,1,2,2,1,2.0
Абайдың Мың бір түн ертегісінің желісімен жаза бастаған Әзім әңгімесі дастаны аяқталмай қалды.,Ұлы ақынның аяқталмай қалған дастаны қалай аталады?,Әзім әңгімесі,Factoid,biblio,1,1,1,1,2,2,2,0,1,1,1,1,2,2,2,0.0
Ұлы ойшылдың 150 жылдығына орай Семейде Абай қоры ұйымы құрылды. Мерейтой 1995 жылы ЮНЕСКО көлемінде аталып өтті.,Абайдың 150 жылдығы қарсаңында Семейде құрылған қоғамдық қайырымдылық ұйымы,Абай қоры,Factoid,art,1,1,1,1,2,2,2,2,1,1,1,1,2,2,2,2.0
"Абайдың 1889 жылы жазған Айттым сәлем, қалам қас... өлеңі әрқайсысы 4 тармақты 10 шумақтан тұрады.","Абайдың Айттым сәлем, қалам қас... өлеңі қанша шумақтан тұрады?",10,Factoid,biblio,0,1,1,1,2,2,2,2,0,1,1,1,2,2,2,2.0
КСРО халық артисі Ришат Абдуллин Қазақстан кәсіби музыкасы тарихында Абай партиясын тұңғыш орындаушы ретінде қалған.,Абай бейнесін ұлттық операда алғаш сомдаған артист,Ришат Абдуллин,Factoid,art,1,1,1,1,2,2,1,2,1,1,1,1,2,2,1,2.0
"0, 1, 2, 3, 4, 5, 6, 7, 8, 9 араб сандары деп аталады. Олар ондық санау системасы бойынша сан жазудың негізі. Араб сандарын үнділер тапқан, кейін келе ол арабтардың арасында таралған.",Араб санау жүйесін кім ойлап тапты?,үнділер,Factoid,math,1,1,1,1,2,2,2,2,1,1,1,1,2,2,2,2.0
"Жазықтық - геометрияның негізгі ұғымдарының бірі, ол аксиомалармен анықталып қабылданады.",Жазықтық деген не?,геометрияның негізгі ұғымдарының бірі,Factoid,math,1,1,1,0,2,2,2,2,1,1,1,0,2,2,2,2.0
Cтереометрия - элементар геометрияның кеңістіктегі фигуралардың қасиеттерін зерттейтін бөлімі,Cтереометрия деген не?,кеңістіктегі фигуралардың қасиеттерін зерттейтін геометрия бөлімі,Factoid,math,1,1,1,0,2,2,2,2,1,1,1,0,2,2,2,2.0
"Функция көбінесе аналитикалық тәсіл немесе формула арқылы, кейде графиктік және таблицалық тәсілдерімен де беріледі. ",Функция көбінесе не  арқылы беріледі? ,аналитикалық тәсіл немесе формула,Factoid,math,1,1,1,1,2,2,2,0,1,1,1,1,2,2,2,0.0
"Эйлер вариациялық есептеу мен дифференциалдық теңдеулер теориясының негізін жасады, дифференциалдық және интегралдық есептеулерді жалпылап, одан әрі дамытты. ",Вариациялық есептеу мен дифференциалдық теңдеулер теориясының негізін кім жасады?,Эйлер,Factoid,math,1,1,1,1,2,2,2,2,1,1,1,1,2,2,2,2.0
Трибология - түйісуші денелердің үйкелісі мен тозуын зерттейтін физиканын бөлімі.,Трибология қай ғылымның саласы?,Физика,Factoid,materials,1,1,1,1,2,2,2,2,1,1,1,1,2,2,2,2.0
Трибология - түйісуші денелердің үйкелісі мен тозуын зерттейтін физиканын бөлімі.,Трибология қай ғылымның бөлімі?,Физика,Factoid,materials,1,1,1,1,2,2,2,2,1,1,1,1,2,2,2,2.0
Трибометрия - үйкелісуші беттердің тозуы мен үйкеліс коэффициенттерін өлшеудің тәсілдері.,Трибометрия деген не?,үйкелісуші беттердің тозуы мен үйкеліс коэффициенттерін өлшеудің тәсілдері,Factoid,materials,1,1,1,0,2,2,2,2,1,1,1,0,2,2,2,2.0
"Блокчейн - бұл үшінші тараптардың жұмыс істеуін қажет етпейтін, дербес жүйе. Сонымен қатар, қарастырылып отырған жүйе өте ашық. Блокчейнді құру барысында әзірлеушілердің басты мақсаты делдалдардан бас тарту болды.",Блокчейнді құрудағы басты мақсат қандай болды?,делдалдардан бас тарту,Factoid,IT,1,1,1,1,2,2,2,2,1,1,1,1,2,2,2,2.0
"Блокчейн - бұл үшінші тараптардың жұмыс істеуін қажет етпейтін, дербес жүйе. Сонымен қатар, қарастырылып отырған жүйе өте ашық. Блокчейнді құру барысында әзірлеушілердің басты мақсаты делдалдардан бас тарту болды.",Блокчейн деген не?,"үшінші тараптардың жұмыс істеуін қажет етпейтін, дербес жүйе",Factoid,IT,1,1,1,0,2,2,2,2,1,1,1,0,2,2,2,2.0
Блокчейн әмиянындағы қаражатқа тек иесі ғана қол жеткізе алады. Ақша әдетте банк болып табылатын делдалдарға салынбайды. Осының арқасында транзакциялар ешкімнің бақылауында болмайды.,Блокчейн әмиянындағы қаражатқа банк қол жеткізе ала ма?,Жоқ,Factoid,IT,1,1,1,1,2,2,2,2,1,1,1,1,2,2,2,2.0
Блокчейн әмиянындағы қаражатқа тек иесі ғана қол жеткізе алады. Ақша әдетте банк болып табылатын делдалдарға салынбайды. Осының арқасында транзакциялар ешкімнің бақылауында болмайды.,Блокчейн әмиянындағы қаражатқа кім қол жеткізе алады?,тек иесі ғана,Factoid,IT,1,1,1,1,2,2,2,2,1,1,1,1,2,2,2,2.0
Транзакциясы шифрленетін және қолдану аясы анонимді түрде болғандықтан биткоинды «криптовалюта» деп те атайды. Биткоин төлемдерінің желісі толықтай дерлік орталықсыздандырылғандықтан қадағалаушысы болмайды.,Биткоинды «криптовалюта» деп неліктен атайды?,транзакциясы шифрленетін және қолдану аясы анонимді түрде болғандықтан,Factoid,IT,1,1,1,0,2,2,2,2,1,1,1,0,2,2,2,2.0
"Биткоиндерді сақтау, қабылдау және жіберу үшін жария идентификатор, қажетті баланс пен жасырын кілтсөзден тұратын әмиян қажет.","Биткоиндерді сақтау, қабылдау және жіберу үшін не керек?","жария идентификатор, қажетті баланс пен жасырын кілтсөзден тұратын әмиян",Factoid,IT,1,1,1,0,2,2,2,2,1,1,1,0,2,2,2,2.0
Шығыс Түрік қағанаты Қытаймен жүргізген қиян-кесті соғыстың нәтижесінде 682 жылы Моңғолияда өз мемлекетін қалпына келтірді.,Шығыс Түрік қағанаты қай мемлекетпен соғысты?,Қытай,Factoid,history,1,1,1,1,2,2,2,2,1,1,1,1,2,2,2,2.0
Шығыс Түрік қағанаты Қытаймен жүргізген қиян-кесті соғыстың нәтижесінде 682 жылы Моңғолияда өз мемлекетін қалпына келтірді.,Шығыс Түрік қағанаты 682 жылы қай жерде өз мемлекетін қалпына келтірді?,Моңғолияда,Factoid,history,1,1,1,1,2,2,2,2,1,1,1,1,2,2,2,2.0
"Зайсан көлі – Қазақстанның көлдерінің Оңтүстік Алтай және Сауыр, Тарбағатай жоталары арасындағы тектоникалық ойыста жатқан тұщы көл. Көл теңіз деңгейінен 395 м биіктікте. Жағалауы жайпақ. Тектоникалық бөген көлдер типіне жатады.",Зайсан көлі теңіз деңгейінен неше метр биіктікте?,395,Factoid,geo,1,1,1,1,2,2,2,2,1,1,1,1,2,2,2,2.0
"Зайсан көлі – Қазақстанның көлдерінің Оңтүстік Алтай және Сауыр, Тарбағатай жоталары арасындағы тектоникалық ойыста жатқан тұщы көл. Көл теңіз деңгейінен 395 м биіктікте. Жағалауы жайпақ. Тектоникалық бөген көлдер типіне жатады.",Зайсан көлінің жағалауы қандай?,жайпақ,Factoid,geo,0,1,1,1,2,2,2,2,0,1,1,1,2,2,2,2.0
"Александр Затаевич Әміренің әншілік өнеріне тәнті болып, одан «Балқадиша», «Дударай», «Бес қарагер», «Көк көбелек», т.б. әндерді жазып алып, «Қазақтың 500 ән мен күйі» (1931) жинағында жариялады. Әміренің әншілік қабілетін кезінде қазақ әдебиеті мен өнерінің көрнекті өкілдері Мұхтар Әуезов, Сәкен Сейфуллин, Иса Байзақов, Әлкей Марғұлан, Жүсіпбек Елебеков, Құрманбек Жандарбеков пен Ахмет Жұбанов өте жоғары бағалаған.",«Қазақтың 500 ән мен күйі» (1931) жинағын жинағын кім шығарды?,Александр Затаевич,Factoid,art,1,1,1,1,2,2,2,2,1,1,1,1,2,2,2,2.0
"Әміренің әншілік қабілетін кезінде қазақ әдебиеті мен өнерінің көрнекті өкілдері Мұхтар Әуезов, Сәкен Сейфуллин, Иса Байзақов, Әлкей Марғұлан, Жүсіпбек Елебеков, Құрманбек Жандарбеков пен Ахмет Жұбанов өте жоғары бағалаған.",Әміренің қай қабілетін кезінде қазақ әдебиеті мен өнерінің көрнекті өкілдері өте жоғары бағалаған?,әншілік қабілетін,Factoid,art,0,1,1,1,2,2,2,2,0,1,1,1,2,2,2,2.0
"Әміренің әншілік қабілетін кезінде қазақ әдебиеті мен өнерінің көрнекті өкілдері Мұхтар Әуезов, Сәкен Сейфуллин, Иса Байзақов, Әлкей Марғұлан, Жүсіпбек Елебеков, Құрманбек Жандарбеков пен Ахмет Жұбанов өте жоғары бағалаған.","Мұхтар Әуезов, Сәкен Сейфуллин, Иса Байзақов, Әлкей Марғұлан, Жүсіпбек Елебеков, Құрманбек Жандарбеков пен Ахмет Жұбанов деген кімдер?",қазақ әдебиеті мен өнерінің көрнекті өкілдері,Factoid,art,0,1,1,1,2,2,2,2,0,1,1,1,2,2,2,2.0
"Әміре Қашаубаев (1888, Дегелең тауының алабы, Қайнар ауылы, Абыралы ауданы, Шығыс Қазақстан облысы - 6 желтоқсан, 1934, Алматы) – атақты әнші, актер әрі музыкант.",Әміре Қашаубаев деген кім?,"атақты әнші, актер әрі музыкант",Factoid,art,1,1,1,1,2,2,2,2,1,1,1,1,2,2,2,2.0
"Әміре әншілік қабілетін ата-анасынан мұра етті: анасы Тойған бұлбұл дауысты музыкант, әкесі Қашаубай әншілік, серілік өнерімен халықты бірнеше рет қуантқан.",Әміренің анасының аты кім еді?,Тойған,Factoid,art,0,1,1,1,2,2,2,2,0,1,1,1,2,2,2,2.0
"Әміре әншілік қабілетін ата-анасынан мұра етті: анасы Тойған бұлбұл дауысты музыкант, әкесі Қашаубай әншілік, серілік өнерімен халықты бірнеше рет қуантқан.",Әміренің әкесінің аты кім еді?,Қашаубай,Factoid,art,0,1,1,1,2,2,2,2,0,1,1,1,2,2,2,2.0
"Әміре әншілік қабілетін ата-анасынан мұра етті: анасы Тойған бұлбұл дауысты музыкант, әкесі Қашаубай әншілік, серілік өнерімен халықты бірнеше рет қуантқан.",Әміре әншілік қабілетін кімдерден мұра етті?,ата-анасынан,Factoid,art,0,1,1,1,2,2,2,2,0,1,1,1,2,2,2,2.0
Графен – бұл кәдімгі алмаз бен графиттен ерекшеленетін көміртегінің жаңа формасы. Графен көміртегінің екі өлшемді модификациясы – қалыңдығы бір атом болатын көміртегі атомдарының қабаты. Бұл заттың қасиеттерінің теориялық зерттелінуі 1947 жылы басталған.,Графеннің қасиеттерін теориялық зерттеу қай жылдан бастап жүргізілді?,1947,Factoid,materials,1,1,1,1,2,2,2,2,1,1,1,1,2,2,2,2.0
Графен электр тогын мыс сияқты жақсы өткізеді. ,Графен қандай металл сияқты электр тогын жақсы өткізеді?,мыс,Factoid,materials,1,1,1,1,2,2,2,2,1,1,1,1,2,2,2,2.0
"Баку, Бақы — Әзірбайжан Республикасының астанасы. Каспий теңізінің батыс жағалауында, Апшерон түбегінің оңтүстігінде орналасқан.",Әзірбайжан Республикасының астанасы қалай аталады?,Баку ,Factoid,geo,1,1,1,1,2,2,2,2,1,1,1,1,2,2,2,2.0
"Баку, Бақы — Әзірбайжан Республикасының астанасы. Каспий теңізінің батыс жағалауында, Апшерон түбегінің оңтүстігінде орналасқан.",Әзірбайжан Республикасының астанасы қай жерде орналасқан?,Каспий теңізінің батыс жағалауында,Factoid,geo,1,1,1,1,2,2,2,2,1,1,1,1,2,2,2,2.0
Python — жоғары дәрежедегі бағдарламалау тілі. Python тілі қазіргі кезде ең көп таралған бағдарламалау тілі болып саналады. ,Python тілі деген не?,жоғары дәрежедегі бағдарламалау тілі,Factoid,IT,1,1,1,0,2,2,2,2,1,1,1,0,2,2,2,2.0
"Python тілі қазіргі таңда кең қолданылатын бағдарламалау тілдерінің бірі. Жасанды интелект, веб серверлер осы тілдін көмегімен құрылады.",Python деген не?,кең қолданылатын бағдарламалау тілдерінің бірі,Factoid,IT,1,1,1,0,2,2,2,2,1,1,1,0,2,2,2,2.0
"Python тілі қазіргі таңда кең қолданылатын бағдарламалау тілдерінің бірі. Жасанды интелект, веб серверлер осы тілдін көмегімен құрылады.",Жасанды интелект қай тілдін көмегімен құрылады?,Python,Factoid,IT,1,1,1,1,2,2,2,2,1,1,1,1,2,2,2,2.0
"Синус (латынша sіnus — дөңестік, иілу) — тригонометриялық функциялардың бірі.",Cинус деген не?,тригонометриялық функция,Factoid,math,1,1,1,0,2,2,2,2,1,1,1,0,2,2,2,2.0
"Қазақ ұлттық техникалық университеті — Қазақстан Республикасы, Алматы қаласында орналасқан техникалық білім беретін жоғары оқу орны. Кеңес Одағы кезінде Ленин атындағы Қазақ Политехникалық Институты деп аталды. 1994 жылы Ленин атындағы Қазақ политехникалық институты Қазақ ұлттық техникалық университеті болып қайта құрылды. Белгілі ғалым Қаныш Сәтбаевтың 100 жылдығына орай, ҚР Үкіметінің 1999 жылы 22 қыркүйектегі №1436 қаулысы бойынша Қазақ техникалық университетіне Қаныш Сәтбаев есімі берілді.",Қазақ техникалық университетіне Қаныш Сәтбаев есімі қай жылы берілді?,1999,Factoid,history,1,1,1,1,2,2,2,2,1,1,1,1,2,2,2,2.0
"Қазақ ұлттық техникалық университеті — Қазақстан Республикасы, Алматы қаласында орналасқан техникалық білім беретін жоғары оқу орны. Кеңес Одағы кезінде Ленин атындағы Қазақ Политехникалық Институты деп аталды.",Қазақ техникалық университеті Кеңес Одағы кезінде қалай аталды?,Ленин атындағы Қазақ Политехникалық Институты,Factoid,history,1,1,1,1,2,2,2,2,1,1,1,1,2,2,2,2.0
Әлемде бидің жүздеген түрі бар. Жыл сайын би өнеріне қызығатын адамдар қатары да артып келеді. 29 сәуірде халықаралық би күні атап өтіледі.,Халықаралық би күні қашан атап өтіледі?,29 сәуірде,Factoid,art,1,1,1,1,2,2,2,2,1,1,1,1,2,2,2,2.0
Үнді би өнері көңіл-күй мен түрлі сезімді көрсете біледі. Сонымен қатар үнді билері ең көне би өнеріне жатады. ,Ең көне би түрі қандай?,үнді биі,Factoid,art,1,1,1,1,2,2,2,2,1,1,1,1,2,2,2,2.0
Гиннесс рекордтар кітабына енген ең ұзақ би 123 сағат 15 минутқа созылған. Биші — Үндістандық Каламандалам Хемаленте. 2011 жылы жасалған бұл рекордты әлі ешкім жаңарта қоймады.,Гиннес рекорттар кітабына енген ең ұзақ би қанша уақытқа созылған?,123 сағат 15 минутқа,Factoid,art,1,1,1,1,2,2,2,2,1,1,1,1,2,2,2,2.0
"Әр мемлекеттің өзіне ғана тән қызық би түрі бар. Мысалы, Перуде үлкен қайшымен билейді. Бұл би 400 жылдан астам уақыт өтсе де, әлі күнге дейін танымал.",Перуде қандай затпен би билейді?,үлкен қайшымен,Factoid,art,1,1,1,1,2,2,2,2,1,1,1,1,2,2,2,2.0
Біздің елімізде ең танымал би – Аққу. Қыздың сұлу мүсіні мен би қимылы аққу құсының әсемдігін айқындай түседі. ,Еліміздегі ең танымал би қандай?,Аққу биі,Factoid,art,1,1,1,1,2,2,2,2,1,1,1,1,2,2,2,2.0
"АҚШ-тың Вирджиния штатында өзгеше бір театр болған. Оның ерекшелігі, сіз театр көру үшін билет сатып алуға ақша емес, заттай дүние апарасыз. Яғни ол тамақ болуы да мүмкін, әлде мүлік. Сіздің мүлкіңіздің құнына қарап орныңыз белгілі болады.  ",АҚШ - тың Вирджиния штатында театр көру үшін билеттің орнына не алып баруға болады?,заттай дүние ,Factoid,art,1,1,1,1,2,2,2,2,1,1,1,1,2,2,2,2.0
27 наурыз барша әлем Театр күнін атап өтеді. World Theatre Day 1961 жылы Вена қаласында өткен  ЮНЕСКО Халықаралық театр институтының IX конгресінде бекітілді. Атаулы күн 1962 жылдан бері тойланып келеді.,Әлемде театр күні қашан аталып өтіледі?,27 наурыз күні,Factoid,art,1,1,1,1,2,2,2,2,1,1,1,1,2,2,2,2.0
